[
  {
    "id": "colgate-korea-2026",
    "title": "Vola in Corea del Sud con Colgate",
    "prize": "Viaggio in Corea del Sud",
    "platform": "Sito web",
    "category": "Viaggi",
    "deadline": "2026-02-28",
    "url": "https://www.vinciconcolgate.it/",
    "termsUrl": "https://www.colgate.it/content/dam/cp-sites/oral-care/oral-care-center/it_it/colgate-special-offers/VolaInCoreaDelSud/Regolamento_Vola_in_Corea_del_Sud.pdf",
    "approved": true
  },
  {
    "id": "regina-vinci-la-spesa-2026",
    "title": "Con REGINA vinci la spesa (3ª ed.)",
    "prize": "Premi istantanei + premi finali (vedi regolamento)",
    "platform": "Sito web",
    "category": "Shopping",
    "deadline": "2026-11-09",
    "url": "https://vincilaspesa.regina.eu/2026/",
    "termsUrl": "https://vincilaspesa.regina.eu/2026/assets/public/REGOLAMENTO_Con_REGINA_vinci_la_spesa_2026_finale.pdf",
    "approved": true
  },
  {
    "id": "esselunga-snow-winners-2026",
    "title": "Esselunga – Snow Winners",
    "prize": "Premi immediati + estrazione finale (vedi regolamento)",
    "platform": "App Esselunga / Web",
    "category": "Tempo Libero",
    "deadline": "2026-03-11",
    "url": "https://www.esselunga.it/it-it/area-aziendale/media-press-area/concorsi/collection-salomon-snow-winners.html",
    "termsUrl": "https://www.esselunga.it/media/promo-e-news/landing/collection-salomon/regolamenti/regolamento-gioco-app-snow-winners.pdf",
    "approved": true
  },
  {
    "id": "lines-dreamers-2026",
    "title": "Lines – Dreamers",
    "prize": "Premi (vedi regolamento)",
    "platform": "Sito web",
    "category": "Moda",
    "deadline": "2026-03-31",
    "url": "https://concorsi.lines.it/dreamers",
    "approved": true
  },
  {
    "id": "lines-forever-2026",
    "title": "Lines – Forever & Pants Days",
    "prize": "Premi (vedi regolamento)",
    "platform": "Sito web",
    "category": "Moda",
    "deadline": "2026-05-05",
    "url": "https://concorsi.lines.it/forever-pants-days",
    "approved": true
  }
]